https://content.onliner.by/news/1400x5616/01a0741431b6b59c88ccc00fd65eaa10.jpeg,Страсти по «икре». Как фальсификат от спекулянтов пробрался в магазин?,"Страсти по «икре». Как фальсификат от спекулянтов пробрался в магазин?
Началось все с сообщения читателя: купил в одной из гомельских торговых сетей банку лососевой икры, попробовал, был сильно разоча"
https://content.onliner.by/news/1400x5616/a28f338b6120cc45618b35df984b772d.jpeg,Распаковываем подарки: что белорусам принес Дед Мороз?,"Распаковываем подарки: что белорусам принес Дед Мороз?
Как известно, белорусы всегда слишком хорошо себя ведут, поэтому Дед Мороз без устали носит им подарки. Перед наступлением 2022 года, прежде чем "
https://content.onliner.by/news/1400x5616/c42e2a696f9aec49f4bfc949659c9f9f.jpeg,"«Встаю в 5 утра, прихожу домой в 23». Истории белорусов, для которых выходные и отпуска — роскошь","«Встаю в 5 утра, прихожу домой в 23». Истории белорусов, для которых выходные и отпуска — роскошь
В этот Новый год белорусам досталось ничтожно мало выходных: во всем виновата праздничная суббота 1 ян"
https://content.onliner.by/news/1400x5616/5ef32689275c91a390737cfba7177f04.jpeg,Откуда такие цены? Разбираем по копейкам чашку кофе,"Откуда такие цены? Разбираем по копейкам чашку кофе
Иногда кажется, что мы очерствели и ничему не удивляемся. Разве что вот этим цифрам на ценниках, которые иногда незапланированно вгрызаются в наши к"
https://content.onliner.by/news/1400x5616/ec553f8732a45d218d458834d58603d2.jpeg,"Холодильники, квартиры, золото... Какие популярные средства накопления последних десятилетий оказались самыми выгодными?","Холодильники, квартиры, золото... Какие популярные средства накопления последних десятилетий оказались самыми выгодными?
Надоели рассказы, как разбогатели купившие биткоин в 2009-м и акции Tesla в 201"
https://content.onliner.by/news/1400x5616/cdc0855dbc13ff0d543cfee068dd391a.jpeg,"«Оптимизм был, пока деньги не закончились». Сколько можно заработать на выпечке хлеба","«Оптимизм был, пока деньги не закончились». Сколько можно заработать на выпечке хлеба
Надоест работа — пойду печь хлеб или булочки. Такие шутливые обещания порой можно услышать от людей, которые устал"
https://content.onliner.by/news/1400x5616/0444ed19473662d24db4ba51d2726ecc.jpeg,Сделал заказ через Instagram — потерял 800 рублей. Как белорусов обманывают в соцсетях,"Сделал заказ через Instagram — потерял 800 рублей. Как белорусов обманывают в соцсетях
На Новый год Дмитрий из Пинска решил себя порадовать мобильным телефоном, а тут как раз перед глазами пронеслась "
https://content.onliner.by/news/1400x5616/6c65db83344f9faf6575b1aec08c4be3.jpeg,"Отказалась от карьеры и заработка в $3000, чтобы рисовать. История счастливого человека","Отказалась от карьеры и заработка в $3000, чтобы рисовать. История счастливого человека
Творчество или работа в офисе? Сытая жизнь и напряженная работа или свобода и постоянное недоедание? Кажется, чт"
https://content.onliner.by/news/1400x5616/3ea66f3c0f98c7bc80bcbcb525075979.jpeg,"«Я считал, что жил по максимуму, и мне было не страшно умирать». История альпиниста, выжившего после падения в горах","СПЕЦПРОЕКТ
«Я считал, что жил по максимуму, и мне было не страшно умирать». История альпиниста, выжившего после падения в горах
Инструктору по альпинизму и горному гиду Юрию Кожухову 45 лет. И больше "
https://content.onliner.by/news/1400x5616/a916cb883ea340aec4477da10303b6fa.jpeg,«Вышла из тюрьмы и через 4 дня уже кололась». Минчанка 19 лет сидит на наркотиках,"«Вышла из тюрьмы и через 4 дня уже кололась». Минчанка 19 лет сидит на наркотиках
Ире (имя изменено) 31 год, большую часть из которых она провела с наркотиками. В игре со смертью она собрала фул хаус:"
https://content.onliner.by/news/1400x5616/1c256687c2eb572aca4887cad15ed7ee.jpeg,Как «Ангел» пытается всех спасти. Но нас это не касается,"Как «Ангел» пытается всех спасти. Но нас это не касается
Каждый знает: ему-то точно никогда не понадобится помощь «Ангела». Периодически мы видим сообщения этой организации в ленте: где-то далеко проп"
https://content.onliner.by/news/1400x5616/3c34510e23598b121c091efabe0ed83a.jpeg,"Папа в декрете: «Друзья шутили, что хорошо устроился: жена деньги зарабатывает, а я дома с ребенком сижу»","Папа в декрете: «Друзья шутили, что хорошо устроился: жена деньги зарабатывает, а я дома с ребенком сижу»
В Барчицах, довольно большой деревне под Бобруйском, тихо и пусто. На улице Центральной ни люд"
https://content.onliner.by/news/1400x5616/35459e961b0aa56d03971ad83203ab46.jpeg,"«Я не надел на себя корону, которая говорит: „Нынешние дети тупые, потому что сидят в TikTok“». Деревенский учитель о новом поколении и зарплате в 1200 рублей","«Я не надел на себя корону, которая говорит: „Нынешние дети тупые, потому что сидят в TikTok“». Деревенский учитель о новом поколении и зарплате в 1200 рублей
Сарья заметена снегом. В этой крошечной д"
https://content.onliner.by/news/1400x5616/8e44bd53353abe3f2c0a4ea0c4362ba2.jpeg,«Братик полез в танк за снарядом — разнесло». Как гражданские жили и умирали посреди войны,"«Братик полез в танк за снарядом — разнесло». Как гражданские жили и умирали посреди войны
Долго бредем по лесу, пока среди деревьев не появляется лысый пригорок. На нем стоит половина (верхняя) цемен"
https://content.onliner.by/news/1400x5616/c2899f8c89d805513c4766a653608f03.jpeg,Он ночевал в поселении каннибалов. Нашли настоящего белорусского Деда-Бородеда,"Он ночевал в поселении каннибалов. Нашли настоящего белорусского Деда-Бородеда
Этот человек на «Аисте» доскрипел до Владивостока. В шлепанцах. Без подготовки поднялся на Килиманджаро, разгоняя лютую х"
https://content.onliner.by/news/1400x5616/b443c1e287c4945d1276aab66d8cefeb.jpeg,"«Сама по стенке хожу, но это не важно». Минчанка неделю ищет сына","«Сама по стенке хожу, но это не важно». Минчанка неделю ищет сына
Наталья толком не спала и не ела примерно с 30 ноября. В тот день ее сын Кирилл Кошкин вышел с работы, но домой не пришел. Ее уже шата"
https://content.onliner.by/news/1400x5616/973d2a0ddbd91ff1eb2735ed98f6e1c1.jpeg,"«Мертвых складывали в машину штабелями». История белоруски, которая была в лагере смерти, но узницей не стала","«Мертвых складывали в машину штабелями». История белоруски, которая была в лагере смерти, но узницей не стала
Антонина Леоновна Грекова неуверенными шагами идет по узкому коридору своего деревенского "
https://content.onliner.by/news/1400x5616/df0bc887147e51469bcedd76f572be96.jpeg,«Зимой мы отрезаны от „большой земли“». Как лодочная переправа спасает жителей поселка на севере Беларуси,"«Зимой мы отрезаны от „большой земли“». Как лодочная переправа спасает жителей поселка на севере Беларуси
Бешенковичи — городской поселок в 50 км от Витебска с населением около 7 тысяч человек. Западн"
https://content.onliner.by/news/1400x5616/4ed3a7dee901caa96cefa2dc13c63649.jpeg,"«Не могла есть и говорить, училась жить заново». Монолог человека, пережившего две операции на мозге","«Не могла есть и говорить, училась жить заново». Монолог человека, пережившего две операции на мозге
Наталья жила жизнью, про которую говорят: «у нее было все». Работала руководителем в отличной компа"
https://content.onliner.by/news/1400x5616/6de13562041ec23ec825fc848c6f2bc6.jpeg,"Из-за опухоли парень перестал расти. Разговор о низкорослости, ее диагностике и лечении","СПЕЦПРОЕКТ
Из-за опухоли парень перестал расти. Разговор о низкорослости, ее диагностике и лечении
Илья Ковель встречает нас вместе с родителями у себя дома в одном из спальных районов Минска. Он учит"
https://content.onliner.by/news/1400x5616/1d52076f9355d411fec2845abc1feb27.jpeg,"«Я пытался угнать поезд и уехать на нем в Оршу». Публикуем дневники парня, болеющего шизофренией","«Я пытался угнать поезд и уехать на нем в Оршу». Публикуем дневники парня, болеющего шизофренией
Зайдите в вагон метро. Осмотритесь. Потерпите несколько станций и непринужденно ступайте на платформу. "
https://content.onliner.by/news/1400x5616/0db66b93cfcc7da3d6286dffa0cac8a7.jpeg,"«Понимая, что кругом жилые дома, они не стали рисковать чужими жизнями». Родные о белорусах, разбившихся под Иркутском","«Понимая, что кругом жилые дома, они не стали рисковать чужими жизнями». Родные о белорусах, разбившихся под Иркутском
Мы до сих пор знаем слишком мало. 3 ноября сквозь ледяной дождь и снег из чукотск"
https://content.onliner.by/news/1400x5616/0b858e8d28dd74b5dff35e44d6b62167.jpeg,«Кто защитит учителя и учеников?» Непростой разговор об обратной стороне буллинга в школе,"«Кто защитит учителя и учеников?» Непростой разговор об обратной стороне буллинга в школе
Один мой знакомый преподаватель рассказывал: «Сколько раз я видел циничное, ухмыляющееся лицо школьника, заним"
https://content.onliner.by/news/1400x5616/25472b5d17f7a2cc33585b11d96c3b86.jpeg,"«Что ни день, плитка заливалась кровью». Как устроена травля в спецшколах и колониях для несовершеннолетних","«Что ни день, плитка заливалась кровью». Как устроена травля в спецшколах и колониях для несовершеннолетних
Сергею Нагановичу 31 год, и за этот короткий, в общем-то, срок он успел испытать такое, о че"
https://content.onliner.by/news/1400x5616/729240d880b8682f8d1ec3f369804f00.jpeg,"Понедельник, моста нет. Что происходило сегодня в Минске?","Понедельник, моста нет. Что происходило сегодня в Минске?
8 января около трех часов ночи рухнула пешеходная часть путепровода через улицу Немигу в самом центре Минска. К счастью, никто не пострадал, ч"
https://content.onliner.by/news/970x485/c1d8f4a6335954522e67b84435f64a2b.jpeg,Какие отзывы оставляют владельцы BMW на «Автобарахолке»?,"Полсотни владельцев автомобилей BMW оставили отзывы в новом сервисе «Автобарахолки». Больше только у Ford и Volkswagen. Средняя оценка у моделей баварской марки — 4,3 звезды. Это средний показатель. У"
https://content.onliner.by/news/970x485/654fc4425e5fa3b6a200f981e4419c7c.jpeg,«Лучше на метро». Как изменится движение на центральных улицах Минска,"К этому часу ГАИ скорректировала схему движения в центре города из-за обрушения моста. Водителям рекомендуют воздержаться от движения по улице Городской Вал, проспекту Независимости и улице Янки Купал"
https://content.onliner.by/news/970x485/1d703dc81a0bba6fb6ebf35a9c9691cd.jpeg,TopGear назвал 10 лучших машин стоимостью до 2700 долларов,"Да, TopGear — это не только телепередача, но и британский автомобильный журнал, а также сайт. И иногда они публикуют что-то типа наших воскресных подборок с «Автобарахолки». Вот, например, топ-10 лучш"
https://content.onliner.by/news/1400x5616/729240d880b8682f8d1ec3f369804f00.jpeg,"Понедельник, моста нет. Что происходило сегодня в Минске?","Понедельник, моста нет. Что происходило сегодня в Минске?
8 января около трех часов ночи рухнула пешеходная часть путепровода через улицу Немигу в самом центре Минска. К счастью, никто не пострадал, ч"
https://content.onliner.by/news/1400x5616/72241a5e9df07ede418ddfaded013fc9.jpeg,Новый мост на Немиге построят в течение месяца? Как сейчас идут работы,"Новый мост на Немиге построят в течение месяца? Как сейчас идут работы
Обрушившийся путепровод над улицей Немигой в настоящее время демонтируют. После начнется возведение нового моста, причем еще неда"
